,author,url,date,rating,review
1293,sroche-23164,https://www.imdb.com/review/rw6017181/?ref_=tt_urv,22 August 2020,10,My head hurts!!
1294,kbarrett6488,https://www.imdb.com/review/rw6080134/?ref_=tt_urv,10 September 2020,8,Can't wait for a second viewing!
1295,steverice-12942,https://www.imdb.com/review/rw6047802/?ref_=tt_urv,30 August 2020,3,Weak plot and poor dialogue
1296,gurkanwal,https://www.imdb.com/review/rw7216905/?ref_=tt_urv,11 August 2021,3,Because (screen colour change) & (everything moving in semi-reverse)
1297,valadas,https://www.imdb.com/review/rw6172337/?ref_=tt_urv,13 October 2020,6,Pounding and thrashing galore
1298,noelgo-44655,https://www.imdb.com/review/rw6017591/?ref_=tt_urv,22 August 2020,10,Christopher Nolan has done it again
1299,quinnwalton-43176,https://www.imdb.com/review/rw6078334/?ref_=tt_urv,9 September 2020,8,TENET
1300,BigHarvey,https://www.imdb.com/review/rw6885271/?ref_=tt_urv,6 May 2021,2,A Tedious Train Wreck!
1301,paolodefy,https://www.imdb.com/review/rw6035789/?ref_=tt_urv,28 August 2020,5,Overkiller
1302,mickdansforth,https://www.imdb.com/review/rw6474645/?ref_=tt_urv,14 January 2021,9,Fun Spy Action Movie
1303,dumanoismarc-35979,https://www.imdb.com/review/rw7261210/?ref_=tt_urv,23 August 2021,5,Huge Christoper Nolan Fan.
1304,shiafromafrica,https://www.imdb.com/review/rw7698381/?ref_=tt_urv,28 December 2021,3,2
1305,mark-34884,https://www.imdb.com/review/rw6432170/?ref_=tt_urv,1 January 2021,2,Terrible sound
1306,ineffablelucky,https://www.imdb.com/review/rw6502147/?ref_=tt_urv,18 January 2021,9,masterpiece
1307,sdmarylou,https://www.imdb.com/review/rw6773334/?ref_=tt_urv,3 April 2021,6,Stayed lost the whole time
1308,Mumix,https://www.imdb.com/review/rw6047218/?ref_=tt_urv,30 August 2020,1,Nolan's worst film
1309,chong_an,https://www.imdb.com/review/rw6055974/?ref_=tt_urv,2 September 2020,7,"Preferably, see the spectacle in IMAX"
1310,dcmurtagh,https://www.imdb.com/review/rw6054136/?ref_=tt_urv,1 September 2020,5,Emperor's New Clothes
1311,moatazmounir-20464,https://www.imdb.com/review/rw6076409/?ref_=tt_urv,8 September 2020,5,Don't feel stupid
1312,Bingewatchers-03194,https://www.imdb.com/review/rw6324543/?ref_=tt_urv,30 November 2020,1,"Boring, unconvincing and weak plot"
1313,thomasellieann,https://www.imdb.com/review/rw6560805/?ref_=tt_urv,3 February 2021,7,Good But Not Nolan's Strongest
1314,ozorjustin,https://www.imdb.com/review/rw6367149/?ref_=tt_urv,15 December 2020,10,The Saviour of 2020
1315,keenanmoore-41734,https://www.imdb.com/review/rw6138232/?ref_=tt_urv,1 October 2020,9,A beautiful friendship
1316,sfx-882-826031,https://www.imdb.com/review/rw6135671/?ref_=tt_urv,29 September 2020,2,2 1/2 Hours Of My Life I'll Never Get Back
1317,markthomassintek,https://www.imdb.com/review/rw6029297/?ref_=tt_urv,26 August 2020,7,WOW but...........
1318,szureikat,https://www.imdb.com/review/rw6047653/?ref_=tt_urv,30 August 2020,3,"If you're a fan of Nolan's films, don't believe the hype!"
1319,Dar Star,https://www.imdb.com/review/rw6981686/?ref_=tt_urv,30 May 2021,5,I mean cmon
1320,michaelan-92852,https://www.imdb.com/review/rw6366109/?ref_=tt_urv,14 December 2020,10,"If you're not willing to watch multiple times, this film is not for you"
1321,mariusboboc18,https://www.imdb.com/review/rw6108626/?ref_=tt_urv,19 September 2020,9,A masterpiece.
1322,thepriceofpayne,https://www.imdb.com/review/rw6186968/?ref_=tt_urv,18 October 2020,7,I think I'll enjoy this more the second time.
1323,erentuna-97421,https://www.imdb.com/review/rw6047285/?ref_=tt_urv,30 August 2020,9,Mind-blowing
1324,eloganeloganelogan,https://www.imdb.com/review/rw6131928/?ref_=tt_urv,28 September 2020,10,Criminally underrated
1325,matthewdimarino,https://www.imdb.com/review/rw6326311/?ref_=tt_urv,1 December 2020,3,How did this movie get green lit?
1326,peterhopwood,https://www.imdb.com/review/rw6036110/?ref_=tt_urv,28 August 2020,9,Is CN Deaf?
1327,mainspring-03696,https://www.imdb.com/review/rw6372461/?ref_=tt_urv,17 December 2020,4,Hope the sound technicians were fired
1328,frank_kneepkens,https://www.imdb.com/review/rw6343352/?ref_=tt_urv,6 December 2020,1,Worthless film
1329,sammytinatree,https://www.imdb.com/review/rw6110315/?ref_=tt_urv,20 September 2020,5,Not as smart as it thinks it is
1330,hollysabin,https://www.imdb.com/review/rw6145526/?ref_=tt_urv,3 October 2020,4,Over-complicated without much subtlety
1331,chris-politz,https://www.imdb.com/review/rw7035369/?ref_=tt_urv,16 June 2021,1,Back and forth... again
1332,thelcar-25668,https://www.imdb.com/review/rw7347844/?ref_=tt_urv,15 September 2021,2,Too much effort required to understand
1333,Booglu,https://www.imdb.com/review/rw6164110/?ref_=tt_urv,10 October 2020,8,It looked nice but I got lost.
1334,craiginiowa,https://www.imdb.com/review/rw6106454/?ref_=tt_urv,18 September 2020,1,What a mess
1335,valentinmh,https://www.imdb.com/review/rw6325173/?ref_=tt_urv,30 November 2020,2,Audaciously stupid...from all angles !
1336,deringencoglu,https://www.imdb.com/review/rw6031040/?ref_=tt_urv,27 August 2020,10,Mindblowing Masterpiece
1337,Cineanalyst,https://www.imdb.com/review/rw6523000/?ref_=tt_urv,24 January 2021,9,The Inverted Tenets of a Cinematic Palindrome
1338,sake420,https://www.imdb.com/review/rw7580996/?ref_=tt_urv,25 November 2021,6,Confusing
1339,jovicajovcic,https://www.imdb.com/review/rw6958261/?ref_=tt_urv,23 May 2021,1,What was going on?
1340,memreasan,https://www.imdb.com/review/rw6607950/?ref_=tt_urv,18 February 2021,7,Are we all dumbs or is it far too complicated?
1341,afrikanese,https://www.imdb.com/review/rw6093489/?ref_=tt_urv,14 September 2020,10,Prepare to stretch your understanding of reality
1342,addinfuad,https://www.imdb.com/review/rw6033451/?ref_=tt_urv,28 August 2020,8,Inception on steroids.
1343,ajruder,https://www.imdb.com/review/rw6069650/?ref_=tt_urv,6 September 2020,8,Some of you need to take a Physics class
1344,R0biSh0bi,https://www.imdb.com/review/rw6101987/?ref_=tt_urv,17 September 2020,5,Could have been executed much better
1345,rnixon-15663,https://www.imdb.com/review/rw6046912/?ref_=tt_urv,30 August 2020,9,Tenet
1346,thierryserra-05310,https://www.imdb.com/review/rw6155693/?ref_=tt_urv,7 October 2020,2,Dumb nonsense. Worst movie of the year!
1347,pavlepredic,https://www.imdb.com/review/rw7642347/?ref_=tt_urv,13 December 2021,1,A great film if you are a machine
1348,gulinskiy,https://www.imdb.com/review/rw6091953/?ref_=tt_urv,13 September 2020,9,"Complicated, but understandable movie innovation"
1349,tomasctinoco,https://www.imdb.com/review/rw6456601/?ref_=tt_urv,9 January 2021,1,Terrible
1350,victor_backus,https://www.imdb.com/review/rw6051427/?ref_=tt_urv,31 August 2020,2,Wish I could travel back 3 hours and tell myself not to watch
1351,vedranasliskovic,https://www.imdb.com/review/rw6358709/?ref_=tt_urv,12 December 2020,1,Very disapoinnted
1352,danny_ea,https://www.imdb.com/review/rw6020112/?ref_=tt_urv,23 August 2020,10,Stop what your doing...
1353,fantard,https://www.imdb.com/review/rw6067455/?ref_=tt_urv,6 September 2020,3,Garbage in Reverse
1354,MrDHWong,https://www.imdb.com/review/rw6030510/?ref_=tt_urv,27 August 2020,9,Yet again proves that Christopher Nolan is one of the best modern filmmakers
1355,misc-161,https://www.imdb.com/review/rw7187343/?ref_=tt_urv,1 August 2021,5,Barely worth it
1356,pugheaven,https://www.imdb.com/review/rw6519158/?ref_=tt_urv,23 January 2021,1,Absolute Drivel
1357,thefendiprint,https://www.imdb.com/review/rw6367539/?ref_=tt_urv,15 December 2020,4,"Congrats, Mr. Nolan. You've truly outdone yourself"
1358,mrwnmero,https://www.imdb.com/review/rw6413768/?ref_=tt_urv,28 December 2020,7,How to create a mystrey? cover the speech with loud music.
1359,chris-h-3,https://www.imdb.com/review/rw6320890/?ref_=tt_urv,29 November 2020,4,A distinct feeling of Deja Vu.
1360,jmpusateri,https://www.imdb.com/review/rw7882096/?ref_=tt_urv,20 February 2022,6,Need to watch a few times to get the idea
1361,jfictitional,https://www.imdb.com/review/rw8055290/?ref_=tt_urv,13 April 2022,7,Batman begins and ends and maybe begins again
1362,dr_john_pollard,https://www.imdb.com/review/rw7460079/?ref_=tt_urv,19 October 2021,2,I Can't Recommend Seeing This Movie!
1363,mxwadia,https://www.imdb.com/review/rw6025147/?ref_=tt_urv,25 August 2020,7,Currently waiting for myself to run back in time and explain this movie to me
1364,atjudkins,https://www.imdb.com/review/rw7335262/?ref_=tt_urv,12 September 2021,10,It's all in the 2nd watch through
1365,tinyfordst,https://www.imdb.com/review/rw6056464/?ref_=tt_urv,2 September 2020,7,The first time Nolan doesn't get a 10/10
1366,emincnl,https://www.imdb.com/review/rw6022822/?ref_=tt_urv,24 August 2020,9,2020?
1367,agla-58329,https://www.imdb.com/review/rw7046600/?ref_=tt_urv,20 June 2021,2,Love Chris nolan films but....
1368,jaysonbing-15463,https://www.imdb.com/review/rw6063692/?ref_=tt_urv,5 September 2020,9,Mind actually blown
1369,carlj12,https://www.imdb.com/review/rw6017173/?ref_=tt_urv,22 August 2020,5,Meh
1370,soccertrainy101,https://www.imdb.com/review/rw6041783/?ref_=tt_urv,29 August 2020,3,"Just because it's Nolan, doesn't mean it's good."
1371,richeysj,https://www.imdb.com/review/rw6136115/?ref_=tt_urv,30 September 2020,9,One Bad Ass Confusing Movie...
1372,mattfogarty-90291,https://www.imdb.com/review/rw6154273/?ref_=tt_urv,7 October 2020,10,Pedal to the metal
1373,madhukar30,https://www.imdb.com/review/rw6358418/?ref_=tt_urv,12 December 2020,8,"A movie fit for the year 2032, not 2020 !!"
1374,ShadiZade,https://www.imdb.com/review/rw6753162/?ref_=tt_urv,28 March 2021,4,An incomprehenisble mess (with cool effects?)
1375,MovieLover8517,https://www.imdb.com/review/rw6044325/?ref_=tt_urv,30 August 2020,2,"Great acting, but hard to understand"
1376,mralexrowe-17282,https://www.imdb.com/review/rw6472734/?ref_=tt_urv,13 January 2021,10,Irony is when reviewers are not smart enough to get the movie so they rate it lower.
1377,bbv-69237,https://www.imdb.com/review/rw6329138/?ref_=tt_urv,2 December 2020,3,Gnab Gib - Big Bang : Nolan missed this time
1378,gfwvmcka,https://www.imdb.com/review/rw7463012/?ref_=tt_urv,20 October 2021,5,What did I just watch
1379,nicolasanstee,https://www.imdb.com/review/rw6028908/?ref_=tt_urv,26 August 2020,5,A perfectly fine film.
1380,connormartin-76888,https://www.imdb.com/review/rw6051575/?ref_=tt_urv,31 August 2020,2,If i could time travel I'd prevent past me from watching this film
1381,harineem-209-525488,https://www.imdb.com/review/rw6900709/?ref_=tt_urv,10 May 2021,3,Pretentious trash
1382,ScottBang,https://www.imdb.com/review/rw6063384/?ref_=tt_urv,5 September 2020,,Just Awful.
1383,jezwood69,https://www.imdb.com/review/rw6089633/?ref_=tt_urv,12 September 2020,2,Over hyped waste of time and money
1384,manopano,https://www.imdb.com/review/rw6072766/?ref_=tt_urv,7 September 2020,8,Confusing at first. Rewarding when thinking about it.
1385,jcdunn-90464,https://www.imdb.com/review/rw6870400/?ref_=tt_urv,2 May 2021,2,Tedium would be a better title
1386,roymyers-68044,https://www.imdb.com/review/rw6378023/?ref_=tt_urv,18 December 2020,3,It should of been Borat not Kenneth's Branagh
1387,ashleyfitches,https://www.imdb.com/review/rw7626136/?ref_=tt_urv,8 December 2021,4,What a mess.
1388,hiflyplane,https://www.imdb.com/review/rw6816035/?ref_=tt_urv,15 April 2021,1,Absolute junk with a lifeless lead
1389,amwriter,https://www.imdb.com/review/rw6206838/?ref_=tt_urv,26 October 2020,3,So wanted to like it but
1390,Bek204,https://www.imdb.com/review/rw6080450/?ref_=tt_urv,10 September 2020,7,"""Don't try to understand it, FEEL IT"""
1391,mjoody-48681,https://www.imdb.com/review/rw6061084/?ref_=tt_urv,4 September 2020,10,Complex but amazing
1392,drakevolkert,https://www.imdb.com/review/rw6522515/?ref_=tt_urv,24 January 2021,1,Awful movie
1393,salehyceruse,https://www.imdb.com/review/rw6156475/?ref_=tt_urv,7 October 2020,1,I honestly couldn't understand anything .
1394,Gavin_NZ,https://www.imdb.com/review/rw6385627/?ref_=tt_urv,21 December 2020,1,"Big budget, big names, huge disappointment"
1395,nickycarriker-78462,https://www.imdb.com/review/rw6127588/?ref_=tt_urv,26 September 2020,8,"As you go backwards, your moving forwards."
1396,danieljames-65664,https://www.imdb.com/review/rw6071407/?ref_=tt_urv,7 September 2020,3,The last christopher nolan film I ever want to see
1397,drshrikantjamdade,https://www.imdb.com/review/rw6930157/?ref_=tt_urv,16 May 2021,4,Disappointing
1398,tracy-97320,https://www.imdb.com/review/rw6340557/?ref_=tt_urv,5 December 2020,2,I thought it was just me but the SOUND
1399,AlexanderFitzmeyer,https://www.imdb.com/review/rw6045952/?ref_=tt_urv,30 August 2020,10,Tenet. (2020)
1400,MaverickV,https://www.imdb.com/review/rw6344190/?ref_=tt_urv,7 December 2020,5,Meh...Meh!
1401,cruise01,https://www.imdb.com/review/rw6069172/?ref_=tt_urv,6 September 2020,10,Absolutely amazing with an epic storytelling and action sequences.
1402,kouroshe84,https://www.imdb.com/review/rw6048281/?ref_=tt_urv,31 August 2020,10,Another mindblowing masterpiece from christopher nolan.
1403,mjosandler,https://www.imdb.com/review/rw6115290/?ref_=tt_urv,22 September 2020,2,Visually fascinating but inaudible
1404,Martipee,https://www.imdb.com/review/rw6020682/?ref_=tt_urv,23 August 2020,3,Almost a good movie
1405,gk303007,https://www.imdb.com/review/rw6117205/?ref_=tt_urv,23 September 2020,8,An appreciable attempt
1406,atmaveeravism,https://www.imdb.com/review/rw6055371/?ref_=tt_urv,2 September 2020,8,It's not grand like inception. but why compare?
1407,callum-128,https://www.imdb.com/review/rw6029566/?ref_=tt_urv,26 August 2020,2,Terrible movie with a terrible plot
1408,cpr3584-1,https://www.imdb.com/review/rw6063770/?ref_=tt_urv,5 September 2020,7,Huh
1409,sofusjunk,https://www.imdb.com/review/rw7290594/?ref_=tt_urv,30 August 2021,5,Reverse entropy? Ever heard of thermodynamics?
1410,IAmIdiotCentral,https://www.imdb.com/review/rw6079600/?ref_=tt_urv,9 September 2020,5,Immensely disappointing
1411,atateus,https://www.imdb.com/review/rw6114281/?ref_=tt_urv,21 September 2020,1,Absolute nonsense
1412,mussie-67780,https://www.imdb.com/review/rw7596274/?ref_=tt_urv,28 November 2021,3,Nolan you are a boring director who knows nothing about action
1413,dimitris-26770,https://www.imdb.com/review/rw6062965/?ref_=tt_urv,4 September 2020,6,Huge disappointment
1414,Harikl,https://www.imdb.com/review/rw6361250/?ref_=tt_urv,13 December 2020,1,Extremely Bad
1415,albethere,https://www.imdb.com/review/rw6769352/?ref_=tt_urv,2 April 2021,,"Exhausting, Unentertaining"
1416,swbrenneman,https://www.imdb.com/review/rw6161637/?ref_=tt_urv,9 October 2020,6,I'm sorry you're not smart enough.
1417,kyle_lyles,https://www.imdb.com/review/rw6870785/?ref_=tt_urv,2 May 2021,1,Bilious Bowel Movement
1418,jdesando,https://www.imdb.com/review/rw6053077/?ref_=tt_urv,1 September 2020,,A visual delight and an intellectual challenge.
1419,timothybidmead,https://www.imdb.com/review/rw6456840/?ref_=tt_urv,9 January 2021,10,Please watch it again - with subtitles (no spoilers)
1420,Dangermouse0,https://www.imdb.com/review/rw6090687/?ref_=tt_urv,13 September 2020,3,Disappointing
1421,mihaibrad777,https://www.imdb.com/review/rw6184251/?ref_=tt_urv,17 October 2020,3,Nolan and numbers
1422,iron_druid,https://www.imdb.com/review/rw6036968/?ref_=tt_urv,28 August 2020,3,When the world gets destroyed and everybody is chill about it
1423,KittyWitty917,https://www.imdb.com/review/rw6429943/?ref_=tt_urv,1 January 2021,7,Ya think ya know
1424,jeffreyycheung,https://www.imdb.com/review/rw6047685/?ref_=tt_urv,30 August 2020,8,Soundtracks are just loud without a motif
1425,zsolt-bogai-259-806739,https://www.imdb.com/review/rw7386710/?ref_=tt_urv,27 September 2021,3,Believe the critics!
1426,torbenmelson,https://www.imdb.com/review/rw6029695/?ref_=tt_urv,26 August 2020,10,I see you at the beginning
1427,galoyanmko,https://www.imdb.com/review/rw6037222/?ref_=tt_urv,29 August 2020,6,Not Nolan's best work. Interesting concept executed poorly.
1428,philippe-art,https://www.imdb.com/review/rw6345668/?ref_=tt_urv,7 December 2020,3,complicated
1429,nlkumar98,https://www.imdb.com/review/rw6345518/?ref_=tt_urv,7 December 2020,8,Matrix
1430,allam74,https://www.imdb.com/review/rw6026095/?ref_=tt_urv,25 August 2020,10,Nolan is something special
1431,Exorcistus,https://www.imdb.com/review/rw6318727/?ref_=tt_urv,28 November 2020,1,"Nolan, Nolan, Nolan..."
1432,vvahaj,https://www.imdb.com/review/rw7294610/?ref_=tt_urv,1 September 2021,1,"Confusing, pointless spy/domestic violence movie"
1433,DonnahL,https://www.imdb.com/review/rw6114341/?ref_=tt_urv,21 September 2020,4,My ears are ringing 24hrs later...No Oscars for Sound Effects
1434,manicmick,https://www.imdb.com/review/rw6384635/?ref_=tt_urv,20 December 2020,8,Confusing at first
1435,beboblack,https://www.imdb.com/review/rw7045626/?ref_=tt_urv,19 June 2021,10,WHAT
1436,rafequick,https://www.imdb.com/review/rw8016091/?ref_=tt_urv,29 March 2022,5,Meh
1437,brittagehrmann,https://www.imdb.com/review/rw6123110/?ref_=tt_urv,25 September 2020,10,Don't overthink it
1438,Johnny-the-Film-Sentinel-2187,https://www.imdb.com/review/rw6091625/?ref_=tt_urv,13 September 2020,8,.eivom gnisufnoc tub dooG
1439,andye-13286,https://www.imdb.com/review/rw6078213/?ref_=tt_urv,9 September 2020,3,Had potential but disappointed
1440,Special-K88,https://www.imdb.com/review/rw6385717/?ref_=tt_urv,21 December 2020,,if any other director you'd be surprised
1441,agieluma,https://www.imdb.com/review/rw7057961/?ref_=tt_urv,23 June 2021,10,"Never have I ever seen a movie fork with my brain like Tenet, and I loved it"
1442,tricky3,https://www.imdb.com/review/rw6082535/?ref_=tt_urv,10 September 2020,5,Poor sound and confusing
1443,DistractedMind101,https://www.imdb.com/review/rw6063379/?ref_=tt_urv,5 September 2020,4,Tenet: a director's film with no clothes
1444,nick_heard,https://www.imdb.com/review/rw6068194/?ref_=tt_urv,6 September 2020,6,Enjoyable but too long..
1445,Silfiriel,https://www.imdb.com/review/rw6348428/?ref_=tt_urv,8 December 2020,5,Incomprehensible and not because of any complex science
1446,IonicBreezeMachine,https://www.imdb.com/review/rw6412014/?ref_=tt_urv,27 December 2020,6,Christopher Nolan falls victim to his own excess.
1447,lennoxhannan,https://www.imdb.com/review/rw6208337/?ref_=tt_urv,26 October 2020,1,"Movies are still worth seeing, really!"
1448,jjkearney-24351,https://www.imdb.com/review/rw6033832/?ref_=tt_urv,28 August 2020,2,Drivel
1449,yntebraaksma,https://www.imdb.com/review/rw6066873/?ref_=tt_urv,5 September 2020,8,Intriguing experience of a complicated concept
1450,eshabelli-737-519566,https://www.imdb.com/review/rw6069746/?ref_=tt_urv,6 September 2020,1,"Disappointing, period. No way I would endure 2+ hours of this garbage again!"
1451,taurus-56911,https://www.imdb.com/review/rw6404207/?ref_=tt_urv,26 December 2020,2,"Wasted 2.5h, then came here..."
1452,farhad-13409,https://www.imdb.com/review/rw6032154/?ref_=tt_urv,27 August 2020,10,"Amazing, just watch it and thank me later."
1453,abeauregard-266-403837,https://www.imdb.com/review/rw6063555/?ref_=tt_urv,5 September 2020,1,What? I can't hear what you said.
1454,benxrichardson,https://www.imdb.com/review/rw6115627/?ref_=tt_urv,22 September 2020,7,In the midst of greatness
1455,Crystal_Dive,https://www.imdb.com/review/rw6061646/?ref_=tt_urv,4 September 2020,2,It is actually EASY to follow
1456,Jeroenvandermeer,https://www.imdb.com/review/rw6055652/?ref_=tt_urv,2 September 2020,6,Just to obvious
1457,rajubhaskr,https://www.imdb.com/review/rw6023863/?ref_=tt_urv,24 August 2020,9,Goosebumps guaranteed
1458,jd_bugman,https://www.imdb.com/review/rw6396750/?ref_=tt_urv,25 December 2020,2,Tries to compete with 'Inception' and simply fails!
1459,mattflohr,https://www.imdb.com/review/rw6768320/?ref_=tt_urv,1 April 2021,4,A thinking man's movie for morons
1460,AudioFileZ,https://www.imdb.com/review/rw6397304/?ref_=tt_urv,25 December 2020,4,I Tried Twice...& Failed Twice Then Gave Up On Tenet
1461,darklydreamingrahu,https://www.imdb.com/review/rw6418724/?ref_=tt_urv,29 December 2020,9,"Not Necessary to Watch Twice, but...."
1462,tcooth,https://www.imdb.com/review/rw6055096/?ref_=tt_urv,2 September 2020,,$200 million buys a lot of full male facial hair...
1463,poison_br,https://www.imdb.com/review/rw6518947/?ref_=tt_urv,23 January 2021,1,Confusing waste of time
1464,planet_of_the_boonies,https://www.imdb.com/review/rw6036851/?ref_=tt_urv,28 August 2020,7,"So many great ideas, completely marred by inaudible dialogue"
1465,moviesfan2,https://www.imdb.com/review/rw8040235/?ref_=tt_urv,7 April 2022,1,Lead actor is awful
1466,sunnyzulfiqar-98456,https://www.imdb.com/review/rw6110343/?ref_=tt_urv,20 September 2020,10,STOP COMPARING IT TO INCEPTION
1467,ahmedadelmsaleh,https://www.imdb.com/review/rw6062668/?ref_=tt_urv,4 September 2020,10,Te N eT
1468,markyk-60135,https://www.imdb.com/review/rw6889135/?ref_=tt_urv,7 May 2021,5,Worth a watch
1469,stretchfoofight,https://www.imdb.com/review/rw6490845/?ref_=tt_urv,17 January 2021,5,"Loud bang, mumble mumble, BANG"
1470,anandsridhar91,https://www.imdb.com/review/rw6432749/?ref_=tt_urv,1 January 2021,1,John David Washington = a piece of wood
1471,hassanejaz2890,https://www.imdb.com/review/rw6061951/?ref_=tt_urv,4 September 2020,9,Tenet : Best Film
1472,analeonorslopes,https://www.imdb.com/review/rw6082617/?ref_=tt_urv,10 September 2020,10,Blew me away. Actual masterpiece.
1473,michaeljameshill-98919,https://www.imdb.com/review/rw7487480/?ref_=tt_urv,28 October 2021,4,Unwatchable Garbage
1474,steveykaeb,https://www.imdb.com/review/rw7287062/?ref_=tt_urv,29 August 2021,5,Not your typical Nolan movie
1475,tuszadorjan,https://www.imdb.com/review/rw6350398/?ref_=tt_urv,9 December 2020,1,Totally not for me...
1476,stuart-smith729,https://www.imdb.com/review/rw6318300/?ref_=tt_urv,28 November 2020,1,Can't hear parts of the movie - needs subtitles
1477,michallucky,https://www.imdb.com/review/rw6575137/?ref_=tt_urv,8 February 2021,10,People are not ready to experience this movie.
1478,Liam3011,https://www.imdb.com/review/rw6118623/?ref_=tt_urv,23 September 2020,9,Christopher Nolan Does it Again!
1479,light-rock,https://www.imdb.com/review/rw6069574/?ref_=tt_urv,6 September 2020,4,Do over
1480,gustaslietuva,https://www.imdb.com/review/rw6861452/?ref_=tt_urv,29 April 2021,6,Dissapointing
1481,sergiorossini,https://www.imdb.com/review/rw7286006/?ref_=tt_urv,29 August 2021,3,Too much time to get your attention
1482,inioi,https://www.imdb.com/review/rw6075170/?ref_=tt_urv,8 September 2020,1,Nolan didn´t do it again.
1483,rayytseng,https://www.imdb.com/review/rw6133759/?ref_=tt_urv,29 September 2020,8,A great movie which leaves the audience behind with its breakneck pace
1484,retailkitchenfit,https://www.imdb.com/review/rw6080833/?ref_=tt_urv,10 September 2020,4,How clever am I? (Mr Nolan)
1485,hesellsmystuff,https://www.imdb.com/review/rw7154211/?ref_=tt_urv,23 July 2021,2,Avoid this movie - SUCH a waste of time
1486,loganastrup,https://www.imdb.com/review/rw6071343/?ref_=tt_urv,7 September 2020,8,Very anxious to see it again and again
1487,Sheldon_biamonte,https://www.imdb.com/review/rw6036148/?ref_=tt_urv,28 August 2020,5,Huhhhh?
1488,bart-sluijter,https://www.imdb.com/review/rw6142841/?ref_=tt_urv,2 October 2020,6,"Nothing interesting happens, at a very high pace"
1489,naveenhareendra,https://www.imdb.com/review/rw6364828/?ref_=tt_urv,14 December 2020,10,Well we'll well
1490,payiyugk,https://www.imdb.com/review/rw6881260/?ref_=tt_urv,5 May 2021,1,Mess
1491,bergchamp-36054,https://www.imdb.com/review/rw6430708/?ref_=tt_urv,1 January 2021,2,W T F
1492,muthurajr-77134,https://www.imdb.com/review/rw6115504/?ref_=tt_urv,22 September 2020,10,"Just Amazing, another masterpiece from sir Christopher Nolan"
1493,deijmaster-49968,https://www.imdb.com/review/rw6327994/?ref_=tt_urv,1 December 2020,3,Impossible to follow - disappointing.
1494,tk-72543,https://www.imdb.com/review/rw6414348/?ref_=tt_urv,28 December 2020,3,Disappointed
1495,ITS_SHOWTIME37,https://www.imdb.com/review/rw6033350/?ref_=tt_urv,28 August 2020,1,An absolute casserole of nonsense
1496,dnsoft,https://www.imdb.com/review/rw6378195/?ref_=tt_urv,18 December 2020,1,Not a movie! 1/10
1497,Aunt_Bee,https://www.imdb.com/review/rw6052298/?ref_=tt_urv,1 September 2020,5,Sound and Fury
1498,khutton-47311,https://www.imdb.com/review/rw7451929/?ref_=tt_urv,17 October 2021,1,My head hurts...
1499,burgif,https://www.imdb.com/review/rw6320813/?ref_=tt_urv,29 November 2020,4,Unecessary too long
1500,achilles-95443,https://www.imdb.com/review/rw6032568/?ref_=tt_urv,27 August 2020,1,Expected more from the storyline
1501,w-bogdan,https://www.imdb.com/review/rw6318606/?ref_=tt_urv,28 November 2020,1,Idiotic beyond belief
1502,robertperner1980,https://www.imdb.com/review/rw6327037/?ref_=tt_urv,1 December 2020,1,I wish I could reverse time to unwatch this movie and get my money back
1503,dusanbozin,https://www.imdb.com/review/rw6386224/?ref_=tt_urv,21 December 2020,1,Timeless boring
1504,niartymail,https://www.imdb.com/review/rw6059241/?ref_=tt_urv,3 September 2020,10,TENET
1505,XxEthanHuntxX,https://www.imdb.com/review/rw6029508/?ref_=tt_urv,26 August 2020,8,The Protagonist
1506,jovana_ivetic,https://www.imdb.com/review/rw6049352/?ref_=tt_urv,31 August 2020,2,Don't Play with Time Travel Unless You're James Cameron
1507,mcaatu,https://www.imdb.com/review/rw6029206/?ref_=tt_urv,26 August 2020,8,Masterpiece
1508,peepaz,https://www.imdb.com/review/rw6050546/?ref_=tt_urv,31 August 2020,1,Nolan is in The Altogether
1509,svozil-706-642770,https://www.imdb.com/review/rw6343079/?ref_=tt_urv,6 December 2020,4,Confusing and feels ridiculous
